{
  "families": {
    "chair_000": {
      "cell_size_px": [
        21,
        32
      ],
      "family_id": "chair_000",
      "parts": {
        "part_00": {
          "asset_id": "chair_000.part_00",
          "source_rect": [
            0,
            0,
            21,
            32
          ],
          "source_status": "present"
        },
        "part_01": {
          "asset_id": "chair_000.part_01",
          "source_rect": [
            21,
            0,
            42,
            32
          ],
          "source_status": "present"
        },
        "part_02": {
          "asset_id": "chair_000.part_02",
          "source_rect": [
            42,
            0,
            63,
            32
          ],
          "source_status": "present"
        },
        "part_03": {
          "asset_id": "chair_000.part_03",
          "source_rect": [
            63,
            0,
            84,
            32
          ],
          "source_status": "present"
        }
      },
      "source_sheet": "01_KAIRO_SPRITE_PACKS/office/chair_000.png",
      "source_sheet_sha256": "92a1800b6bc9d0e1e1fa0e439c9d14dfeaafeb7bad8d4c0353d5ab03029d74c8"
    },
    "chair_001": {
      "cell_size_px": [
        21,
        32
      ],
      "family_id": "chair_001",
      "parts": {
        "part_00": {
          "asset_id": "chair_001.part_00",
          "source_rect": [
            0,
            0,
            21,
            32
          ],
          "source_status": "present"
        },
        "part_01": {
          "asset_id": "chair_001.part_01",
          "source_rect": [
            21,
            0,
            42,
            32
          ],
          "source_status": "present"
        },
        "part_02": {
          "asset_id": "chair_001.part_02",
          "source_rect": [
            42,
            0,
            63,
            32
          ],
          "source_status": "present"
        },
        "part_03": {
          "asset_id": "chair_001.part_03",
          "source_rect": [
            63,
            0,
            84,
            32
          ],
          "source_status": "present"
        }
      },
      "source_sheet": "01_KAIRO_SPRITE_PACKS/office/chair_001.png",
      "source_sheet_sha256": "6e1ab4537c41ef75688d3adb665ec003a7e85f3af1e51daa7f359aff90ea3028"
    },
    "chair_002": {
      "cell_size_px": [
        21,
        32
      ],
      "family_id": "chair_002",
      "parts": {
        "part_00": {
          "asset_id": "chair_002.part_00",
          "source_rect": [
            0,
            0,
            21,
            32
          ],
          "source_status": "present"
        },
        "part_01": {
          "asset_id": "chair_002.part_01",
          "source_rect": [
            21,
            0,
            42,
            32
          ],
          "source_status": "present"
        },
        "part_02": {
          "asset_id": "chair_002.part_02",
          "source_rect": [
            42,
            0,
            63,
            32
          ],
          "source_status": "present"
        },
        "part_03": {
          "asset_id": "chair_002.part_03",
          "source_rect": [
            63,
            0,
            84,
            32
          ],
          "source_status": "present"
        }
      },
      "source_sheet": "01_KAIRO_SPRITE_PACKS/office/chair_002.png",
      "source_sheet_sha256": "849e518eaeb77a72734d4784e33ed339af84db8149b08ea897c6721932ec5906"
    },
    "chair_003": {
      "cell_size_px": [
        21,
        32
      ],
      "family_id": "chair_003",
      "parts": {
        "part_00": {
          "asset_id": "chair_003.part_00",
          "source_rect": [
            0,
            0,
            21,
            32
          ],
          "source_status": "present"
        },
        "part_01": {
          "asset_id": "chair_003.part_01",
          "source_rect": [
            21,
            0,
            42,
            32
          ],
          "source_status": "present"
        },
        "part_02": {
          "asset_id": "chair_003.part_02",
          "source_rect": [
            42,
            0,
            63,
            32
          ],
          "source_status": "present"
        },
        "part_03": {
          "asset_id": "chair_003.part_03",
          "source_rect": [
            63,
            0,
            84,
            32
          ],
          "source_status": "present"
        }
      },
      "source_sheet": "01_KAIRO_SPRITE_PACKS/office/chair_003.png",
      "source_sheet_sha256": "2f255425d4c04768c1493f9c8baaa0eca40ed1dee87a5b691f00e7c349dce66e"
    },
    "chair_004": {
      "cell_size_px": [
        21,
        32
      ],
      "family_id": "chair_004",
      "parts": {
        "part_00": {
          "asset_id": "chair_004.part_00",
          "source_rect": [
            0,
            0,
            21,
            32
          ],
          "source_status": "present"
        },
        "part_01": {
          "asset_id": "chair_004.part_01",
          "source_rect": [
            21,
            0,
            42,
            32
          ],
          "source_status": "present"
        },
        "part_02": {
          "asset_id": "chair_004.part_02",
          "source_rect": [
            42,
            0,
            63,
            32
          ],
          "source_status": "present"
        },
        "part_03": {
          "asset_id": null,
          "source_rect": [
            63,
            0,
            84,
            32
          ],
          "source_status": "transparent_by_source"
        }
      },
      "source_sheet": "01_KAIRO_SPRITE_PACKS/office/chair_004.png",
      "source_sheet_sha256": "739be7a5b730ad07b26931877be9b06cb5bb35c324f09632bb77875085e9dd40"
    },
    "chair_005": {
      "cell_size_px": [
        21,
        32
      ],
      "family_id": "chair_005",
      "parts": {
        "part_00": {
          "asset_id": "chair_005.part_00",
          "source_rect": [
            0,
            0,
            21,
            32
          ],
          "source_status": "present"
        },
        "part_01": {
          "asset_id": "chair_005.part_01",
          "source_rect": [
            21,
            0,
            42,
            32
          ],
          "source_status": "present"
        },
        "part_02": {
          "asset_id": "chair_005.part_02",
          "source_rect": [
            42,
            0,
            63,
            32
          ],
          "source_status": "present"
        },
        "part_03": {
          "asset_id": null,
          "source_rect": [
            63,
            0,
            84,
            32
          ],
          "source_status": "transparent_by_source"
        }
      },
      "source_sheet": "01_KAIRO_SPRITE_PACKS/office/chair_005.png",
      "source_sheet_sha256": "0149d0440afdb4a05bf6918e7328b921912596622b234cac9e3a020a55c1e8ea"
    },
    "chair_006": {
      "cell_size_px": [
        21,
        32
      ],
      "family_id": "chair_006",
      "parts": {
        "part_00": {
          "asset_id": "chair_006.part_00",
          "source_rect": [
            0,
            0,
            21,
            32
          ],
          "source_status": "present"
        },
        "part_01": {
          "asset_id": "chair_006.part_01",
          "source_rect": [
            21,
            0,
            42,
            32
          ],
          "source_status": "present"
        },
        "part_02": {
          "asset_id": "chair_006.part_02",
          "source_rect": [
            42,
            0,
            63,
            32
          ],
          "source_status": "present"
        },
        "part_03": {
          "asset_id": "chair_006.part_03",
          "source_rect": [
            63,
            0,
            84,
            32
          ],
          "source_status": "present"
        }
      },
      "source_sheet": "01_KAIRO_SPRITE_PACKS/office/chair_006.png",
      "source_sheet_sha256": "74e2ae46412a73b502445caa6f2369370cbcffc66d1297219580d219c35a52dc"
    },
    "chair_007": {
      "cell_size_px": [
        21,
        32
      ],
      "family_id": "chair_007",
      "parts": {
        "part_00": {
          "asset_id": "chair_007.part_00",
          "source_rect": [
            0,
            0,
            21,
            32
          ],
          "source_status": "present"
        },
        "part_01": {
          "asset_id": "chair_007.part_01",
          "source_rect": [
            21,
            0,
            42,
            32
          ],
          "source_status": "present"
        },
        "part_02": {
          "asset_id": "chair_007.part_02",
          "source_rect": [
            42,
            0,
            63,
            32
          ],
          "source_status": "present"
        },
        "part_03": {
          "asset_id": "chair_007.part_03",
          "source_rect": [
            63,
            0,
            84,
            32
          ],
          "source_status": "present"
        }
      },
      "source_sheet": "01_KAIRO_SPRITE_PACKS/office/chair_007.png",
      "source_sheet_sha256": "d86c31d826de9f048dadf7309f2deab8c4921133c81558c3a071fdf56bd6c512"
    },
    "chair_008": {
      "cell_size_px": [
        21,
        32
      ],
      "family_id": "chair_008",
      "parts": {
        "part_00": {
          "asset_id": "chair_008.part_00",
          "source_rect": [
            0,
            0,
            21,
            32
          ],
          "source_status": "present"
        },
        "part_01": {
          "asset_id": "chair_008.part_01",
          "source_rect": [
            21,
            0,
            42,
            32
          ],
          "source_status": "present"
        },
        "part_02": {
          "asset_id": "chair_008.part_02",
          "source_rect": [
            42,
            0,
            63,
            32
          ],